{
  "id": "kr_kimchi_fried_rice",
  "slug": "kimchi-fried-rice",
  "category": "korean",
  "type": "MAIN",
  "mealTime": ["LUNCH", "DINNER", "LATE_NIGHT"],
  "title": { "ko": "김치볶음밥", "en": "Kimchi Fried Rice" },
  "subtitle": {
    "ko": "간단하고 든든한 기본 메뉴",
    "en": "Simple and satisfying fried rice"
  },
  "description": {
    "ko": "잘 익은 김치로 빠르게 만드는 한국식 볶음밥이에요.",
    "en": "Korean-style fried rice made with well-fermented kimchi."
  },
  "difficulty": "easy",
  "cookTime": 15,
  "servings": 1,
  "tags": ["quick", "comfort", "solo", "rice_based", "late_night", "one_pot"],
  "emotions": ["warm", "cozy", "nostalgic"],
  "ingredients": [
    { "name": { "ko": "밥", "en": "Cooked rice" }, "amount": "1공기" },
    { "name": { "ko": "김치", "en": "Kimchi" }, "amount": "1/2컵" },
    { "name": { "ko": "참기름", "en": "Sesame oil" }, "amount": "1작은술" },
    { "name": { "ko": "간장", "en": "Soy sauce" }, "amount": "1작은술" },
    { "name": { "ko": "김가루", "en": "Seaweed flakes" }, "amount": "1큰술" },
    { "name": { "ko": "계란", "en": "Egg" }, "amount": "1개", "optional": true }
  ],
  "steps": [
    {
      "order": 1,
      "instruction": {
        "ko": "팬에 참기름을 두르고 김치를 볶아요.",
        "en": "Heat sesame oil in a pan and stir-fry the kimchi."
      },
      "hankkiMessage": {
        "id": "msg_kr_kimchi_rice_step_1",
        "locale": "ko",
        "context": "step_guide",
        "text": "김치부터 볶으면 깊은 맛이 나요!"
      }
    },
    {
      "order": 2,
      "instruction": {
        "ko": "밥을 넣고 골고루 볶아요.",
        "en": "Add rice and stir-fry until evenly mixed."
      },
      "hankkiMessage": {
        "id": "msg_kr_kimchi_rice_step_2",
        "locale": "ko",
        "context": "step_guide",
        "text": "밥이 김치랑 고르게 섞이면 됐어요."
      }
    },
    {
      "order": 3,
      "instruction": {
        "ko": "간장으로 간을 맞추고 김가루를 뿌려요.",
        "en": "Season with soy sauce and sprinkle seaweed flakes."
      },
      "hankkiMessage": {
        "id": "msg_kr_kimchi_rice_step_3",
        "locale": "ko",
        "context": "step_guide",
        "text": "간은 조금씩 맞춰보면 딱 좋아요."
      }
    },
    {
      "order": 4,
      "instruction": {
        "ko": "계란 프라이를 올리면 더 든든해요.",
        "en": "Top with a fried egg for extra heartiness."
      },
      "hankkiMessage": {
        "id": "msg_kr_kimchi_rice_step_4",
        "locale": "ko",
        "context": "completion",
        "text": "김치볶음밥 완성! 정말 맛있겠어요 😊"
      }
    }
  ],
  "hankkiTip": {
    "id": "msg_kr_kimchi_rice_tip",
    "locale": "ko",
    "context": "tip",
    "text": "마지막에 참기름 한 방울이 포인트예요."
  },
  "image": { "emoji": "🍚", "url": null },
  "meta": {
    "version": "1.0.0",
    "status": "published",
    "createdAt": "2026-07-06",
    "updatedAt": "2026-07-06"
  }
}
